[
  { "robot_id": "robot-hb1", "name": "Hallbot 1", "platform": "differential drive", "sensors": ["lidar-2d", "imu", "wheel-odometry"], "urdf_ref": "urdf/hallbot.urdf", "pose_m": { "xyz": [-2.0, 0.4, 0.0], "rpy": [0, 0, 0] }, "size_m": [0.6, 0.8, 0.6], "bench": "bench-a", "dock_id": "dock-1", "tags": ["hardware", "mobile", "slam"], "commissioned_on": "2026-07-10", "logged_on": "2026-07-10" },
  { "robot_id": "robot-hb2", "name": "Hallbot 2", "platform": "differential drive", "sensors": ["lidar-2d", "imu", "camera"], "urdf_ref": "urdf/hallbot.urdf", "pose_m": { "xyz": [-1.0, 0.4, 0.5], "rpy": [0, 0, 1.57] }, "size_m": [0.6, 0.8, 0.6], "bench": "bench-a", "dock_id": "dock-1", "tags": ["hardware", "mobile", "slam"], "commissioned_on": "2026-07-12", "logged_on": "2026-07-12" },
  { "robot_id": "lidar-rig", "name": "Lidar test rig", "platform": "static rig", "sensors": ["lidar-3d", "imu"], "urdf_ref": "urdf/lidar-rig.urdf", "pose_m": { "xyz": [2.0, 0.6, -0.5], "rpy": [0, 0, 0] }, "size_m": [0.4, 1.2, 0.4], "bench": "bench-b", "tags": ["hardware", "sensor", "vibration"], "commissioned_on": "2026-08-01", "logged_on": "2026-08-01" },
  { "robot_id": "arm-1", "name": "Bench arm", "platform": "6-dof arm", "sensors": ["joint-encoders", "wrist-camera"], "urdf_ref": "urdf/bench-arm.urdf", "pose_m": { "xyz": [2.5, 0.9, 1.0], "rpy": [0, 0, 0] }, "size_m": [0.3, 0.9, 0.3], "bench": "bench-b", "tags": ["hardware", "manipulation"], "commissioned_on": "2026-05-20", "logged_on": "2026-05-20" },
  { "robot_id": "dock-1", "name": "Charging dock", "platform": "dock", "sensors": [], "pose_m": { "xyz": [-2.5, 0.1, 1.2], "rpy": [0, 0, 0] }, "size_m": [0.5, 0.2, 0.5], "bench": "bench-a", "tags": ["power"], "commissioned_on": "2026-07-10", "logged_on": "2026-07-10" }
]
